[
 {
  "estimated": false,
  "extent": "whole",
  "locator": {
   "end": "01:07:24",
   "start": "01:05:49"
  },
  "meeting_date": "2024-12-10",
  "minutes": 1.58,
  "thread": "gaza",
  "transcript_archive_id": "bcc-2024-12-10-special-and-regular-captions-text",
  "turn_id": "bcc-2024-12-10-special-and-regular-captions-text#turn-0"
 },
 {
  "estimated": false,
  "extent": "whole",
  "locator": {
   "end": "02:07:28",
   "start": "02:05:23"
  },
  "meeting_date": "2024-12-10",
  "minutes": 2.08,
  "thread": "gaza",
  "transcript_archive_id": "bcc-2024-12-10-special-and-regular-captions-text",
  "turn_id": "bcc-2024-12-10-special-and-regular-captions-text#turn-1"
 },
 {
  "estimated": true,
  "extent": "partial",
  "locator": {
   "end_line": 770,
   "start_line": 732
  },
  "meeting_date": "2025-01-21",
  "minutes": 1.78,
  "thread": "gaza",
  "transcript_archive_id": "bcc-2025-01-21-regular-captions-text",
  "turn_id": "bcc-2025-01-21-regular-captions-text#turn-2"
 },
 {
  "estimated": true,
  "extent": "whole",
  "locator": {
   "end_line": 2289,
   "start_line": 2260
  },
  "meeting_date": "2025-01-21",
  "minutes": 1.27,
  "thread": "gaza",
  "transcript_archive_id": "bcc-2025-01-21-regular-captions-text",
  "turn_id": "bcc-2025-01-21-regular-captions-text#turn-3"
 },
 {
  "estimated": true,
  "extent": "partial",
  "locator": {
   "end_line": 401,
   "start_line": 376
  },
  "meeting_date": "2025-02-11",
  "minutes": 1.35,
  "thread": "gaza",
  "transcript_archive_id": "bcc-2025-02-11-regular-captions-text",
  "turn_id": "bcc-2025-02-11-regular-captions-text#turn-4"
 },
 {
  "estimated": true,
  "extent": "whole",
  "locator": {
   "end_line": 481,
   "start_line": 456
  },
  "meeting_date": "2025-02-11",
  "minutes": 1.22,
  "thread": "gaza",
  "transcript_archive_id": "bcc-2025-02-11-regular-captions-text",
  "turn_id": "bcc-2025-02-11-regular-captions-text#turn-5"
 },
 {
  "estimated": true,
  "extent": "whole",
  "locator": {
   "end_line": 632,
   "start_line": 534
  },
  "meeting_date": "2025-02-11",
  "minutes": 4.46,
  "thread": "gaza",
  "transcript_archive_id": "bcc-2025-02-11-regular-captions-text",
  "turn_id": "bcc-2025-02-11-regular-captions-text#turn-6"
 },
 {
  "estimated": true,
  "extent": "partial",
  "locator": {
   "end_line": 1071,
   "start_line": 1026
  },
  "meeting_date": "2025-02-11",
  "minutes": 2.1,
  "thread": "gaza",
  "transcript_archive_id": "bcc-2025-02-11-regular-captions-text",
  "turn_id": "bcc-2025-02-11-regular-captions-text#turn-7"
 },
 {
  "estimated": true,
  "extent": "whole",
  "locator": {
   "end_line": 4703,
   "start_line": 4678
  },
  "meeting_date": "2025-02-11",
  "minutes": 1.3,
  "thread": "gaza",
  "transcript_archive_id": "bcc-2025-02-11-regular-captions-text",
  "turn_id": "bcc-2025-02-11-regular-captions-text#turn-8"
 },
 {
  "estimated": true,
  "extent": "whole",
  "locator": {
   "end_line": 4752,
   "start_line": 4725
  },
  "meeting_date": "2025-02-11",
  "minutes": 1.27,
  "thread": "gaza",
  "transcript_archive_id": "bcc-2025-02-11-regular-captions-text",
  "turn_id": "bcc-2025-02-11-regular-captions-text#turn-9"
 },
 {
  "estimated": true,
  "extent": "whole",
  "locator": {
   "end_line": 4799,
   "start_line": 4758
  },
  "meeting_date": "2025-02-11",
  "minutes": 2.02,
  "thread": "gaza",
  "transcript_archive_id": "bcc-2025-02-11-regular-captions-text",
  "turn_id": "bcc-2025-02-11-regular-captions-text#turn-10"
 },
 {
  "estimated": true,
  "extent": "partial",
  "locator": {
   "end_line": 4890,
   "start_line": 4864
  },
  "meeting_date": "2025-02-11",
  "minutes": 1.3,
  "thread": "gaza",
  "transcript_archive_id": "bcc-2025-02-11-regular-captions-text",
  "turn_id": "bcc-2025-02-11-regular-captions-text#turn-11"
 },
 {
  "estimated": true,
  "extent": "whole",
  "locator": {
   "end_line": 4966,
   "start_line": 4938
  },
  "meeting_date": "2025-02-11",
  "minutes": 1.33,
  "thread": "gaza",
  "transcript_archive_id": "bcc-2025-02-11-regular-captions-text",
  "turn_id": "bcc-2025-02-11-regular-captions-text#turn-12"
 },
 {
  "estimated": true,
  "extent": "whole",
  "locator": {
   "end_line": 4997,
   "start_line": 4970
  },
  "meeting_date": "2025-02-11",
  "minutes": 1.33,
  "thread": "gaza",
  "transcript_archive_id": "bcc-2025-02-11-regular-captions-text",
  "turn_id": "bcc-2025-02-11-regular-captions-text#turn-13"
 },
 {
  "estimated": true,
  "extent": "whole",
  "locator": {
   "end_line": 153,
   "start_line": 126
  },
  "meeting_date": "2025-02-25",
  "minutes": 1.23,
  "thread": "gaza",
  "transcript_archive_id": "bcc-2025-02-25-regular-captions-text",
  "turn_id": "bcc-2025-02-25-regular-captions-text#turn-14"
 },
 {
  "estimated": true,
  "extent": "whole",
  "locator": {
   "end_line": 234,
   "start_line": 208
  },
  "meeting_date": "2025-02-25",
  "minutes": 1.09,
  "thread": "gaza",
  "transcript_archive_id": "bcc-2025-02-25-regular-captions-text",
  "turn_id": "bcc-2025-02-25-regular-captions-text#turn-15"
 },
 {
  "estimated": true,
  "extent": "partial",
  "locator": {
   "end_line": 306,
   "start_line": 277
  },
  "meeting_date": "2025-02-25",
  "minutes": 1.3,
  "thread": "gaza",
  "transcript_archive_id": "bcc-2025-02-25-regular-captions-text",
  "turn_id": "bcc-2025-02-25-regular-captions-text#turn-16"
 },
 {
  "estimated": true,
  "extent": "whole",
  "locator": {
   "end_line": 414,
   "start_line": 400
  },
  "meeting_date": "2025-02-25",
  "minutes": 0.59,
  "thread": "gaza",
  "transcript_archive_id": "bcc-2025-02-25-regular-captions-text",
  "turn_id": "bcc-2025-02-25-regular-captions-text#turn-17"
 },
 {
  "estimated": true,
  "extent": "partial",
  "locator": {
   "end_line": 447,
   "start_line": 418
  },
  "meeting_date": "2025-02-25",
  "minutes": 1.29,
  "thread": "gaza",
  "transcript_archive_id": "bcc-2025-02-25-regular-captions-text",
  "turn_id": "bcc-2025-02-25-regular-captions-text#turn-18"
 },
 {
  "estimated": true,
  "extent": "whole",
  "locator": {
   "end_line": 478,
   "start_line": 455
  },
  "meeting_date": "2025-02-25",
  "minutes": 1.12,
  "thread": "gaza",
  "transcript_archive_id": "bcc-2025-02-25-regular-captions-text",
  "turn_id": "bcc-2025-02-25-regular-captions-text#turn-19"
 },
 {
  "estimated": true,
  "extent": "whole",
  "locator": {
   "end_line": 692,
   "start_line": 666
  },
  "meeting_date": "2025-02-25",
  "minutes": 1.13,
  "thread": "gaza",
  "transcript_archive_id": "bcc-2025-02-25-regular-captions-text",
  "turn_id": "bcc-2025-02-25-regular-captions-text#turn-20"
 },
 {
  "estimated": true,
  "extent": "partial",
  "locator": {
   "end_line": 772,
   "start_line": 758
  },
  "meeting_date": "2025-02-25",
  "minutes": 0.62,
  "thread": "gaza",
  "transcript_archive_id": "bcc-2025-02-25-regular-captions-text",
  "turn_id": "bcc-2025-02-25-regular-captions-text#turn-21"
 },
 {
  "estimated": true,
  "extent": "whole",
  "locator": {
   "end_line": 903,
   "start_line": 874
  },
  "meeting_date": "2025-02-25",
  "minutes": 1.23,
  "thread": "gaza",
  "transcript_archive_id": "bcc-2025-02-25-regular-captions-text",
  "turn_id": "bcc-2025-02-25-regular-captions-text#turn-22"
 },
 {
  "estimated": true,
  "extent": "whole",
  "locator": {
   "end_line": 931,
   "start_line": 905
  },
  "meeting_date": "2025-02-25",
  "minutes": 1.15,
  "thread": "gaza",
  "transcript_archive_id": "bcc-2025-02-25-regular-captions-text",
  "turn_id": "bcc-2025-02-25-regular-captions-text#turn-23"
 },
 {
  "estimated": true,
  "extent": "partial",
  "locator": {
   "end_line": 1021,
   "start_line": 993
  },
  "meeting_date": "2025-02-25",
  "minutes": 1.12,
  "thread": "gaza",
  "transcript_archive_id": "bcc-2025-02-25-regular-captions-text",
  "turn_id": "bcc-2025-02-25-regular-captions-text#turn-24"
 },
 {
  "estimated": true,
  "extent": "whole",
  "locator": {
   "end_line": 1054,
   "start_line": 1025
  },
  "meeting_date": "2025-02-25",
  "minutes": 1.25,
  "thread": "gaza",
  "transcript_archive_id": "bcc-2025-02-25-regular-captions-text",
  "turn_id": "bcc-2025-02-25-regular-captions-text#turn-25"
 },
 {
  "estimated": true,
  "extent": "whole",
  "locator": {
   "end_line": 1146,
   "start_line": 1132
  },
  "meeting_date": "2025-02-25",
  "minutes": 0.54,
  "thread": "gaza",
  "transcript_archive_id": "bcc-2025-02-25-regular-captions-text",
  "turn_id": "bcc-2025-02-25-regular-captions-text#turn-26"
 },
 {
  "estimated": true,
  "extent": "whole",
  "locator": {
   "end_line": 3919,
   "start_line": 3878
  },
  "meeting_date": "2025-02-25",
  "minutes": 1.83,
  "thread": "gaza",
  "transcript_archive_id": "bcc-2025-02-25-regular-captions-text",
  "turn_id": "bcc-2025-02-25-regular-captions-text#turn-27"
 },
 {
  "estimated": true,
  "extent": "partial",
  "locator": {
   "end_line": 3958,
   "start_line": 3923
  },
  "meeting_date": "2025-02-25",
  "minutes": 1.61,
  "thread": "gaza",
  "transcript_archive_id": "bcc-2025-02-25-regular-captions-text",
  "turn_id": "bcc-2025-02-25-regular-captions-text#turn-28"
 },
 {
  "estimated": true,
  "extent": "partial",
  "locator": {
   "end_line": 3986,
   "start_line": 3962
  },
  "meeting_date": "2025-02-25",
  "minutes": 1.02,
  "thread": "gaza",
  "transcript_archive_id": "bcc-2025-02-25-regular-captions-text",
  "turn_id": "bcc-2025-02-25-regular-captions-text#turn-29"
 },
 {
  "estimated": true,
  "extent": "whole",
  "locator": {
   "end_line": 407,
   "start_line": 381
  },
  "meeting_date": "2025-03-11",
  "minutes": 1.22,
  "thread": "gaza",
  "transcript_archive_id": "bcc-2025-03-11-regular-captions-text",
  "turn_id": "bcc-2025-03-11-regular-captions-text#turn-30"
 },
 {
  "estimated": true,
  "extent": "whole",
  "locator": {
   "end_line": 444,
   "start_line": 415
  },
  "meeting_date": "2025-03-11",
  "minutes": 1.46,
  "thread": "gaza",
  "transcript_archive_id": "bcc-2025-03-11-regular-captions-text",
  "turn_id": "bcc-2025-03-11-regular-captions-text#turn-31"
 },
 {
  "estimated": true,
  "extent": "whole",